{
  "version": 2,
  "verbs": [
    "get", "list", "create", "update", "delete", "search", "send", "run",
    "fetch", "read", "write", "add", "remove", "merge", "trigger", "query",
    "move", "duplicate", "restore", "cancel", "navigate", "click",
    "push", "call", "describe", "batch", "enable", "disable", "fork",
    "resolve", "unresolve", "edit", "modify", "append", "download", "upload",
    "install", "close"
  ],
  "conjunctions": ["or", "and"],
  "singularExceptions": [
    "data", "news", "series", "status", "analytics",
    "alias", "aws", "atlas", "bias", "canvas", "gas", "ios", "lens", "species"
  ],
  "singularIrregular": {
    "statuses": "status",
    "aliases": "alias",
    "caches": "cache",
    "people": "person",
    "children": "child",
    "indices": "index",
    "analyses": "analysis"
  }
}
